{
  "job_version": "DAE-DOCX-JOB-1.0",
  "source_admission": "LOCAL_HASH",
  "bibliographic": {
    "author": "Immanuel Kant",
    "title": "The Critique of Pure Reason — frozen holdout excerpt 2/3",
    "publication": "Public-domain primary text; Project Gutenberg eBook #4280; deterministic excerpt at 50% of cleaned text",
    "year": 1781,
    "language": "en",
    "genre": "primary philosophical text excerpt"
  },
  "access_policy": {
    "analysis_class": "DERIVATIVE_ONLY",
    "raw_text_retention": "TRANSIENT",
    "redistribution": "AUTHORIZED",
    "allow_derived_outputs": true,
    "basis": "Public-domain primary text excerpt selected deterministically before DAE execution. Project Gutenberg wrapper removed; source URL and hashes retained in holdout manifest.",
    "restrictions_checked_at": "2026-08-11T19:20:00Z"
  },
  "crosswalk": {
    "target_edition": "The Critique of Pure Reason",
    "status": "PAGE_LEVEL_PARTIAL",
    "target_locator": "Project Gutenberg eBook #4280; deterministic cleaned-word interval [103930,105130) around 50%",
    "evidence_refs": [
      "https://www.gutenberg.org/ebooks/4280"
    ],
    "note": "Frozen holdout excerpt; no manual semantic selection."
  },
  "structure": {
    "drop_line_patterns": [],
    "analyze_notes": true
  },
  "rendering": {
    "page_label_prefix": "H2"
  }
}
